{
  "$schema": "https://json-schema.org/draft/2020-12/schema",
  "additionalProperties": false,
  "properties": {
    "container_mode": {
      "type": "string"
    },
    "default_access_mode": {
      "type": "string"
    },
    "default_locale": {
      "type": "string"
    },
    "deployment": {
      "type": "string"
    },
    "developer_preview": {
      "type": "boolean"
    },
    "disk_bytes": {
      "type": "integer"
    },
    "docker_source_url": {
      "type": "string"
    },
    "icon": {
      "additionalProperties": false,
      "properties": {
        "media_type": {
          "type": "string"
        },
        "path": {
          "type": "string"
        }
      },
      "required": [
        "path",
        "media_type"
      ],
      "type": "object"
    },
    "kind": {
      "const": "redeven.service-template"
    },
    "locales": {
      "items": {
        "type": "string"
      },
      "type": "array"
    },
    "notices": {
      "items": {
        "additionalProperties": false,
        "properties": {
          "acknowledgement_required": {
            "type": "boolean"
          },
          "id": {
            "type": "string"
          },
          "revision": {
            "type": "integer"
          },
          "severity": {
            "type": "string"
          }
        },
        "required": [
          "id",
          "revision",
          "severity",
          "acknowledgement_required"
        ],
        "type": "object"
      },
      "type": "array"
    },
    "platform_artifacts": {
      "additionalProperties": {
        "type": "string"
      },
      "type": "object"
    },
    "recommended_version": {
      "type": "string"
    },
    "release_discovery": {
      "additionalProperties": false,
      "properties": {
        "source": {
          "type": "string"
        }
      },
      "required": [
        "source"
      ],
      "type": "object"
    },
    "revision": {
      "type": "integer"
    },
    "schema_version": {
      "const": 4
    },
    "service_family_id": {
      "type": "string"
    },
    "sort_order": {
      "type": "integer"
    },
    "source_url": {
      "type": "string"
    },
    "spec": {
      "oneOf": [
        {
          "$ref": "redeven-service-template-spec-v7.schema.json"
        }
      ]
    },
    "supported_platforms": {
      "items": {
        "type": "string"
      },
      "type": "array"
    },
    "template_id": {
      "type": "string"
    }
  },
  "required": [
    "kind",
    "schema_version",
    "template_id",
    "service_family_id",
    "revision",
    "default_locale",
    "locales",
    "spec"
  ],
  "title": "Redeven Service Template document",
  "type": "object"
}
