{
  "schema_version": 4,
  "template_id": "deepseek-harness-container",
  "service_family_id": "deepseek-harness-container",
  "recommended_version": "0.2.1-rc.2-r1-ungoogled.1",
  "revision": 22,
  "sort_order": 20,
  "developer_preview": true,
  "disk_bytes": 2147483648,
  "source_url": "https://github.com/deepseek-ai/deepseek-harness",
  "docker_source_url": "https://github.com/runzhliu/deepseek-harness-docker",
  "deployment": "container",
  "container_mode": "single",
  "default_access_mode": "desktop_loopback",
  "platform_artifacts": {"linux-amd64":"ghcr.io/runzhliu/deepseek-harness:0.2.1-rc.2-r1-ungoogled.1@sha256:53cf8ba32a1aa3485d4ddc3e9b013b712616affb881cd76f64538f88b7855285","linux-arm64":"ghcr.io/runzhliu/deepseek-harness:0.2.1-rc.2-r1-ungoogled.1@sha256:69af9b01dddcd1ae0725537ed6ea2aedbe966f12776bde5115531c231cb6286e"},
  "release_discovery": {
    "source": "oci"
  },
  "notices": [
    {
      "id": "community-container-image",
      "revision": 1,
      "severity": "warning",
      "acknowledgement_required": false
    },
    {
      "id": "service-api-credentials",
      "revision": 1,
      "severity": "info",
      "acknowledgement_required": false
    }
  ],
  "icon": {
    "path": "assets/icon.svg",
    "media_type": "image/svg+xml"
  },
  "spec": {
    "schema_version": 7,
    "kind": "container",
    "endpoint": {
      "scheme": "http",
      "container_port": 3080,
      "health_path": "/",
      "startup_timeout_sec": 45
    },
    "startup_url": {"line_prefix": "dsh web: "},
    "container": {
      "image": "${REDEVEN_CATALOG_ARTIFACT}",
      "environment": {
        "DSH_DESKTOP_ENABLED": "0",
        "DSH_HOME": "/home/node/.dsh",
        "HOME": "/workspace"
      },
      "mounts": [
        {
          "resource_id": "data",
          "type": "volume",
          "source": "data",
          "target": "/home/node/.dsh"
        },
        {
          "resource_id": "workspace",
          "type": "workspace",
          "target": "/workspace"
        },
        {
          "resource_id": "tmp",
          "type": "tmpfs",
          "target": "/tmp"
        }
      ],
      "user": "1000:1000",
      "read_only_root": true,
      "pids_limit": 512
    }
  },
  "kind": "redeven.service-template",
  "default_locale": "en-US",
  "locales": [
    "en-US",
    "zh-CN",
    "zh-TW",
    "ja-JP",
    "ko-KR",
    "de-DE",
    "fr-FR",
    "es-ES",
    "pt-BR",
    "ru-RU"
  ]
}
